Index,Unique Identifier,S&P 500,DJIA,Nasdaq 100,Regions,Sub-Regions,Country,Ticker,Company Name,Company Description,Year Incorporated,Headquarters,Website,Wiki,X,Sec SIC Code,Sec SIC Industry Title,NAICS Sector Code,NAICS Sector,NAICS Subsector Code,NAICS Subsector,NAICS Industry Group Code,NAICS Industry Group,NAICS Industry Code,NAICS Industry,NAICS National Industry Code,NAICS National Industry
1,US-1,S&P 500,,,Americas,North America,United States,A,"Agilent Technologies, Inc.","Agilent Technologies, Inc provides technology or software solutions.",1999,"California,  United States",http://www.agilent.com/,https://en.wikipedia.org/wiki/agilent_technologies_inc,https://x.com/agilent,3826,Laboratory Analytical Instruments,31-33,Manufacturing,334,Computer And Electronic Product Manufacturing,3345,"Navigational, Measuring, Electromedical, And Control Instruments Manufacturing",33451,"Navigational, Measuring, Electromedical, And Control Instruments Manufacturing",334516,Analytical Laboratory Instrument Manufacturing 
2,US-2,S&P 500,DJIA,Nasdaq 100,Americas,North America,United States,AAPL,Apple Inc.,Apple Inc is a diversified company across consumer or industrial sectors.,1977,"California,  United States",https://www.apple.com/,https://en.wikipedia.org/wiki/apple_inc.,https://x.com/apple,3571,Electronic Computers,31-33,Manufacturing,334,Computer And Electronic Product Manufacturing,3342,Communications Equipment Manufacturing,33422,Radio And Television Broadcasting And Wireless Communications Equipment Manufacturing,334220,Radio And Television Broadcasting And Wireless Communications Equipment Manufacturing
3,US-3,S&P 500,,,Americas,North America,United States,ABBV,Abbvie Inc.,AbbVie Inc is a diversified company across consumer or industrial sectors.,2012,"Illinois,  United States",http://www.abbvie.com/,https://en.wikipedia.org/wiki/abbvie_inc.,https://x.com/abbvie,2834,Pharmaceutical Preparations,31-33,Manufacturing,325,Chemical Manufacturing,3254,Pharmaceutical And Medicine Manufacturing,32541,Pharmaceutical And Medicine Manufacturing,325412,Pharmaceutical Preparation Manufacturing 
4,US-4,S&P 500,,Nasdaq 100,Americas,North America,United States,ABNB,"Airbnb, Inc.","Airbnb, Inc operates in the airline or transportation sector.",2008,"California,  United States","	https://www.airbnb.com",https://en.wikipedia.org/wiki/Airbnb,https://x.com/Airbnb,7340,Dwellings & Other Buildings,56,"Administrative Support, Waste Management & Remediation Services",561,Administrative And Support Services,5615,Travel Arrangement And Reservation Services,56159,Other Travel Arrangement And Reservation Services,561599,All Other Travel Arrangement And Reservation Services 
5,US-5,S&P 500,,,Americas,North America,United States,ABT,Abbott Laboratories,Abbott Laboratories is a global healthcare company,1900,"Illinois,  United States",http://www.abbott.com/,https://en.wikipedia.org/wiki/abbott_laboratories,https://x.com/abbottnews,2834,Pharmaceutical Preparations,31-33,Manufacturing,339,Miscellaneous Manufacturing,3391,Medical Equipment And Supplies Manufacturing,33911,Medical Equipment And Supplies Manufacturing,339112,Surgical And Medical Instrument Manufacturing 
6,US-6,S&P 500,,,Americas,North America,United States,ACGL,Arch Capital Group Ltd.,Arch Capital Group Ltd is a diversified company across consumer or industrial sectors.,2000,"Pembroke,  Bermuda",https://www.archgroup.com,https://en.wikipedia.org/wiki/arch_capital_group,,6331,"Fire, Marine & Casualty Insurance",52,Finance And Insurance,524,Insurance Carriers And Related Activities,5241,Insurance Carriers,52413,Reinsurance Carriers ,524130,Reinsurance Carriers 
7,IE-3,S&P 500,,,"Europe, The Middle East and Africa",Western Europe,Ireland,ACN,Accenture Public Limited Company,Accenture plc is a global professional services company,2009,"Dublin,  Ireland",https://www.accenture.com/,https://en.wikipedia.org/wiki/accenture_plc,https://x.com/accenture,7389,"Business Services, Nec",54,"Professional, Scientific, And Technical Services",541,"Professional, Scientific, And Technical Services",5415,Computer Systems Design And Related Services,54151,Computer Systems Design And Related Services,541519,Other Computer Related Services
8,US-7,S&P 500,,Nasdaq 100,Americas,North America,United States,ADBE,Adobe Inc.,Adobe Inc is a diversified company across consumer or industrial sectors.,1997,"California,  United States",https://www.adobe.com/,https://en.wikipedia.org/wiki/adobe_inc.,https://x.com/adobe,7372,Prepackaged Software,51,Information,511,Publishing Industries (Except Internet),5112,Software Publishers,51121,Software Publishers,511210,Software Publishers
9,US-8,S&P 500,,Nasdaq 100,Americas,North America,United States,ADI,"Analog Devices, Inc.","Analog Devices, Inc is a diversified company across consumer or industrial sectors.",1965,"Massachusetts,  United States",https://www.analog.com/,"https://en.wikipedia.org/wiki/analog_devices,_inc.",https://x.com/adi_news,3674,Semiconductors & Related Devices,31-33,Manufacturing,334,Computer And Electronic Product Manufacturing,3344,Semiconductor And Other Electronic Component Manufacturing,33441,Semiconductor And Other Electronic Component Manufacturing,334413,Semiconductor And Related Device Manufacturing 
10,US-9,S&P 500,,,Americas,North America,United States,ADM,Archer-Daniels-Midland Company.,Archer-Daniels-Midland Company is a human and animal nutrition company,1923,"Illinois,  United States",https://www.adm.com/,https://en.wikipedia.org/wiki/archer-daniels-midland_co,https://x.com/tradeadmis,2070,Fats & Oils,31-33,Manufacturing,311,Food Manufacturing,3112,Grain And Oilseed Milling,31122,Starch And Vegetable Fats And Oils Manufacturing,311224,Soybean And Other Oilseed Processing 
11,US-10,S&P 500,,Nasdaq 100,Americas,North America,United States,ADP,"Automatic Data Processing, Inc.","Automatic Data Processing, Inc is involved in automotive services or products.",1961,"New Jersey,  United States",https://www.adp.co.uk/,https://en.wikipedia.org/wiki/automatic_data_processing,https://x.com/adp,7374,Computer Processing & Data Preparation,51,Information,518,"Data Processing, Hosting, And Related Services",5182,"Data Processing, Hosting, And Related Services",51821,"Data Processing, Hosting, And Related Services",518210,"Data Processing, Hosting, And Related Services"
12,US-11,S&P 500,,Nasdaq 100,Americas,North America,United States,ADSK,"Autodesk, Inc.","Autodesk, Inc is involved in automotive services or products.",1994,"California,  United States",https://www.autodesk.co.uk/,https://en.wikipedia.org/wiki/autodesk_inc.,https://x.com/autodesk,7372,Prepackaged Software,51,Information,511,Publishing Industries (Except Internet),5112,Software Publishers,51121,Software Publishers,511210,Software Publishers
13,US-12,S&P 500,,,Americas,North America,United States,AEE,Ameren Corporation,Ameren Corporation is a public utility holding company,1995,"Missouri,  United States",http://www.ameren.com/,https://en.wikipedia.org/wiki/ameren_corp,https://x.com/amerencorp,4931,Electric & Other Services Combined,22,Utilities,221,Utilities,2211,"Electric Power Generation, Transmission And Distribution",22111,Electric Power Generation,221118,Other Electric Power Generation 
14,US-13,S&P 500,,Nasdaq 100,Americas,North America,United States,AEP,"American Electric Power Company, Inc.","American Electric Power Company, Inc is active in the energy sector.",1925,"Ohio,  United States",http://www.aep.com/,https://en.wikipedia.org/wiki/american_electric_power,https://x.com/aepnews,4911,Electric Services,22,Utilities,221,Utilities,2211,"Electric Power Generation, Transmission And Distribution",22112,"Electric Power Transmission, Control, And Distribution",221122,Electric Power Distribution 
15,US-14,S&P 500,,,Americas,North America,United States,AES,The Aes Corporation,The AES Corporation is a power generation and utility company,1981,"Virginia,  United States",http://aes.com/,https://en.wikipedia.org/wiki/aes_corp,https://x.com/theaescorp,4991,Cogeneration Services & Small Power Producers,22,Utilities,221,Utilities,2211,"Electric Power Generation, Transmission And Distribution",22112,"Electric Power Transmission, Control, And Distribution",221122,Electric Power Distribution 
16,US-15,S&P 500,,,Americas,North America,United States,AFL,Aflac Incorporated,Aflac Incorporated is engaged in supplemental health and life insurance company,1973,"Georgia,  United States",http://www.aflac.com/,https://en.wikipedia.org/wiki/aflac_inc,https://x.com/aflac,6321,Accident & Health Insurance,52,Finance And Insurance,524,Insurance Carriers And Related Activities,5241,Insurance Carriers,52411,"Direct Life, Health, And Medical Insurance Carriers ",524114,Direct Health And Medical Insurance Carriers 
17,US-16,S&P 500,,,Americas,North America,United States,AIG,"American International Group, Inc.","American International Group, Inc is a diversified company across consumer or industrial sectors.",1967,"New York,  United States",http://www.aig.com/,https://en.wikipedia.org/wiki/american_international_group,https://x.com/aiginsurance,6331,"Fire, Marine & Casualty Insurance",52,Finance And Insurance,524,Insurance Carriers And Related Activities,5241,Insurance Carriers,52412,"Direct Insurance (Except Life, Health, And Medical) Carriers ",524126,Direct Property And Casualty Insurance Carriers 
18,US-17,S&P 500,,,Americas,North America,United States,AIZ,"Assurant, Inc.","Assurant, Inc is a diversified company across consumer or industrial sectors.",2003,"Georgia,  United States",http://www.assurant.com/,https://en.wikipedia.org/wiki/assurant,https://x.com/assurant,6399,"Insurance Carriers, Nec",52,Finance And Insurance,524,Insurance Carriers And Related Activities,5242,"Agencies, Brokerages, And Other Insurance Related Activities",52429,Other Insurance Related Activities ,524298,All Other Insurance Related Activities 
19,US-18,S&P 500,,,Americas,North America,United States,AJG,Arthur J. Gallagher & Co.,Arthur J is a diversified company across consumer or industrial sectors.,1972,"Illinois,  United States",http://www.ajg.com/,https://en.wikipedia.org/wiki/arthur_j._gallagher_%26_co.,https://x.com/gallagherglobal,6411,"Insurance Agents, Brokers & Service",52,Finance And Insurance,524,Insurance Carriers And Related Activities,5242,"Agencies, Brokerages, And Other Insurance Related Activities",52421,Insurance Agencies And Brokerages ,524210,Insurance Agencies And Brokerages 
20,US-19,S&P 500,,,Americas,North America,United States,AKAM,"Akamai Technologies, Inc.","Akamai Technologies, Inc provides technology or software solutions.",1998,"Massachusetts,  United States",https://www.akamai.com/,https://en.wikipedia.org/wiki/akamai_technologies_inc,https://x.com/akamai,7389,"Business Services, Nec",56,"Administrative Support, Waste Management & Remediation Services",561,Administrative And Support Services,5614,Business Support Services,56149,Other Business Support Services,561499,All Other Business Support Services 
21,US-20,S&P 500,,,Americas,North America,United States,ALB,Albemarle Corporation,"Albemarle Corporation is a global developer, manufacturer and marketer of specialty chemicals",1993,"North Carolina,  United States",http://www.albemarle.com/,https://en.wikipedia.org/wiki/albemarle_corp,https://x.com/albemarlecorp,2821,"Plastic Materials, Synth Resins & Nonvulcan Elastomers",31-33,Manufacturing,325,Chemical Manufacturing,3259,Other Chemical Product And Preparation Manufacturing,32599,All Other Chemical Product And Preparation Manufacturing,325998,All Other Miscellaneous Chemical Product And Preparation Manufacturing 
22,US-21,S&P 500,,,Americas,North America,United States,ALGN,"Align Technology, Inc.","Align Technology, Inc provides technology or software solutions.",1997,"Arizona,  United States",https://www.aligntech.com/,https://en.wikipedia.org/wiki/align_technology,https://x.com/aligntechinc,3842,"Orthopedic, Prosthetic & Surgical Appliances & Supplies",31-33,Manufacturing,339,Miscellaneous Manufacturing,3391,Medical Equipment And Supplies Manufacturing,33911,Medical Equipment And Supplies Manufacturing,339113,Surgical Appliance And Supplies Manufacturing 
23,US-22,S&P 500,,,Americas,North America,United States,ALL,The Allstate Corporation,The Allstate Corporation is a holding company for Allstate Insurance Company,1992,"Illinois,  United States",http://www.allstate.com/,https://en.wikipedia.org/wiki/allstate_corp,https://x.com/allstate,6331,"Fire, Marine & Casualty Insurance",52,Finance And Insurance,524,Insurance Carriers And Related Activities,5241,Insurance Carriers,52412,"Direct Insurance (Except Life, Health, And Medical) Carriers ",524126,Direct Property And Casualty Insurance Carriers 
24,IE-4,S&P 500,,,"Europe, The Middle East and Africa",Western Europe,Ireland,ALLE,Allegion Public Limited Company,Allegion plc (Allegion) is a global provider of security products and solutions,2013,"Dublin,  Ireland",http://www.allegion.com/,https://en.wikipedia.org/wiki/allegion,https://x.com/allegionplc,7381,"Detective, Guard & Armored Car Services",56,"Administrative Support, Waste Management & Remediation Services",561,Administrative And Support Services,5616,Investigation And Security Services,56161,"Investigation, Guard, And Armored Car Services",561612,Security Guards And Patrol Services 
25,US-23,S&P 500,,Nasdaq 100,Americas,North America,United States,AMAT,"Applied Materials, Inc.","Applied Materials, Inc is a diversified company across consumer or industrial sectors.",1987,"California,  United States",http://www.appliedmaterials.com/,https://en.wikipedia.org/wiki/applied_materials_inc.,https://x.com/applied4tech,3674,Semiconductors & Related Devices,31-33,Manufacturing,334,Computer And Electronic Product Manufacturing,3344,Semiconductor And Other Electronic Component Manufacturing,33441,Semiconductor And Other Electronic Component Manufacturing,334413,Semiconductor And Related Device Manufacturing 
26,US-24,S&P 500,,,Americas,North America,United States,AMCR,Amcor Plc,Amcor plc is a packaging company,2018,"Bristol,  United Kingdom",http://www.amcor.com/,https://en.wikipedia.org/wiki/amcor_plc,https://x.com/amcorpackaging,3990,Miscellaneous Manufacturing Industries,31-33,Manufacturing,322,Paper Manufacturing,3222,Converted Paper Product Manufacturing,32221,Paperboard Container Manufacturing,322211,Corrugated And Solid Fiber Box Manufacturing 
27,US-25,S&P 500,,Nasdaq 100,Americas,North America,United States,AMD,"Advanced Micro Devices, Inc.","Advanced Micro Devices, Inc is a diversified company across consumer or industrial sectors.",1969,"California,  United States",https://www.amd.com/,https://en.wikipedia.org/wiki/advanced_micro_devices_inc,https://x.com/amd,3674,Semiconductors & Related Devices,31-33,Manufacturing,334,Computer And Electronic Product Manufacturing,3344,Semiconductor And Other Electronic Component Manufacturing,33441,Semiconductor And Other Electronic Component Manufacturing,334413,Semiconductor And Related Device Manufacturing 
28,US-26,S&P 500,,,Americas,North America,United States,AME,"Ametek, Inc.","AMETEK, Inc is a diversified company across consumer or industrial sectors.",1986,"Pennsylvania,  United States",http://www.ametek.com/,https://en.wikipedia.org/wiki/ametek_inc.,https://x.com/ametekinc,3823,"Industrial Instruments For Measurement, Display, And Control",31-33,Manufacturing,333,Machinery Manufacturing,3332,Industrial Machinery Manufacturing,33324,Industrial Machinery Manufacturing,333249,Other Industrial Machinery Manufacturing 
29,US-27,S&P 500,DJIA,Nasdaq 100,Americas,North America,United States,AMGN,Amgen Inc.,Amgen Inc is a diversified company across consumer or industrial sectors.,1986,"California,  United States",https://www.amgen.com/,https://en.wikipedia.org/wiki/amgen_inc.,https://x.com/amgen,2836,"Biological Products, (No Disgnostic Substances)",31-33,Manufacturing,325,Chemical Manufacturing,3254,Pharmaceutical And Medicine Manufacturing,32541,Pharmaceutical And Medicine Manufacturing,325412,Pharmaceutical Preparation Manufacturing 
30,US-28,S&P 500,,,Americas,North America,United States,AMP,"Ameriprise Financial, Inc.","Ameriprise Financial, Inc is a diversified company across consumer or industrial sectors.",1983,"Minnesota,  United States",http://www.ameriprise.com/,https://en.wikipedia.org/wiki/ameriprise_financial,https://x.com/ameriprise,6282,Investment Advice,52,Finance And Insurance,523,"Securities, Commodity Contracts, And Other Financial Investments And Related Activities",5239,Other Financial Investment Activities,52393,Investment Advice ,523930,Investment Advice 
31,US-29,S&P 500,,,Americas,North America,United States,AMT,American Tower Corporation,American Tower Corporation is a holding company,1996,"Massachusetts,  United States",http://www.americantower.com/,https://en.wikipedia.org/wiki/american_tower_corp.,https://x.com/AmericanTowerUS,6798,Real Estate Investment Trusts,52,Finance And Insurance,525,"Funds, Trusts, And Other Financial Vehicles ",5259,Other Investment Pools And Funds,52599,Other Financial Vehicles ,525990,Other Financial Vehicles 
32,US-30,S&P 500,DJIA,Nasdaq 100,Americas,North America,United States,AMZN,"Amazon.Com, Inc.",Amazon is a diversified company across consumer or industrial sectors.,1996,"Washington,  United States",https://www.aboutamazon.com/,https://en.wikipedia.org/wiki/amazon.com_inc.,https://x.com/amazon,5961,Catalog & Mail-Order Houses,44-45,Retail Trade,454,Nonstore Retailers ,4541,Electronic Shopping And Mail-Order Houses ,45411,Electronic Shopping And Mail-Order Houses ,454110,Electronic Shopping And Mail-Order Houses 
33,US-31,S&P 500,,,Americas,North America,United States,ANET,"Arista Networks, Inc.","Arista Networks, Inc is a diversified company across consumer or industrial sectors.",2011,"California,  United States",https://www.arista.com/en/,https://en.wikipedia.org/wiki/arista_networks,https://x.com/aristanetworks,3576,Computer Communications Equipment,31-33,Manufacturing,334,Computer And Electronic Product Manufacturing,3341,Computer And Peripheral Equipment Manufacturing,33411,Computer And Peripheral Equipment Manufacturing,334118,Computer Terminal And Other Computer Peripheral Equipment Manufacturing 
35,IE-6,S&P 500,,,"Europe, The Middle East and Africa",Western Europe,Ireland,AON,Aon Plc,Aon PLC is a global professional services company,2020,"Dublin,  Ireland",http://www.aon.com/,https://en.wikipedia.org/wiki/aon_plc,https://x.com/aon_plc,6411,"Insurance Agents, Brokers & Service",52,Finance And Insurance,524,Insurance Carriers And Related Activities,5241,Insurance Carriers,52412,"Direct Insurance (Except Life, Health, And Medical) Carriers ",524126,Direct Property And Casualty Insurance Carriers 
36,US-33,S&P 500,,,Americas,North America,United States,AOS,A. O. Smith Corporation,A. O. Smith Corporation is a diversified company across consumer or industrial sectors.,1986,"Wisconsin,  United States",http://www.aosmith.com/,https://en.wikipedia.org/wiki/a.o._smith_corp,https://x.com/aosmithhotwater,3630,Household Appliances,31-33,Manufacturing,335,"Electrical Equipment, Appliance, And Component Manufacturing",3353,Electrical Equipment Manufacturing,33531,Electrical Equipment Manufacturing,335312,Motor And Generator Manufacturing 
37,US-34,S&P 500,,,Americas,North America,United States,APA,Apa Corporation,"APA Corporation is an independent energy company that explores for, develops, and produces natural gas, crude oil, and natural gas liquids (NGLs)",2021,"Texas,  United States",http://www.apachecorp.com/,https://en.wikipedia.org/wiki/apache_corporation,https://x.com/apa_corp,1311,Crude Petroleum & Natural Gas,21,"Mining, Quarrying, And Oil And Gas Extraction",211,Oil And Gas Extraction,2111,Oil And Gas Extraction,21112,Crude Petroleum Extraction ,211120,Crude Petroleum Extraction 
38,US-35,S&P 500,,,Americas,North America,United States,APD,"Air Products And Chemicals, Inc.","Air Products and Chemicals, Inc operates in the airline or transportation sector.",1961,"Pennsylvania,  United States",http://www.airproducts.com/,https://en.wikipedia.org/wiki/air_products_%26_chemicals_inc,https://x.com/airproducts,2810,Industrial Inorganic Chemicals,31-33,Manufacturing,325,Chemical Manufacturing,3251,Basic Chemical Manufacturing,32518,Other Basic Inorganic Chemical Manufacturing,325180,Other Basic Inorganic Chemical Manufacturing 
39,US-36,S&P 500,,,Americas,North America,United States,APH,Amphenol Corporation,"Amphenol Corporation is a designer, manufacturer, and marketer of electrical, electronic and fiber optic connectors and interconnect systems, antennas, sensors and sensor-based products, and coaxial and high-speed specialty cables",1986,"Connecticut,  United States",https://www.amphenol.co.uk/,https://en.wikipedia.org/wiki/amphenol_corp,https://x.com/amphenol,3678,Electronic Connectors,31-33,Manufacturing,335,"Electrical Equipment, Appliance, And Component Manufacturing",3359,Other Electrical Equipment And Component Manufacturing,33592,Communication And Energy Wire And Cable Manufacturing,335929,Other Communication And Energy Wire Manufacturing 
40,US-37,S&P 500,,Nasdaq 100,Americas,North America,United States,APP,AppLovin Corporation,"AppLovin Corporation delivers AI-powered advertising and monetisation solutions for mobile applications, operating through its Advertising and Apps segments. Its platform includes AppDiscovery (AI-driven ad matching), MAX (in-app bidding), Adjust (analytics and attribution), and Wurl (connected TV monetisation), alongside a portfolio of mobile games via owned and partner studios.",2011,"California,  United States","	applovin.com",https://en.wikipedia.org/wiki/AppLovin,https://x.com/applovin,7370,"Services-Computer Programming, Data Processing, Etc.",51,Information,513,Publishing Industries,5132,Software Publishers,51321,Software Publishers,513210,Software Publishers
41,IE-7,S&P 500,,,"Europe, The Middle East and Africa",Western Europe,Ireland,APTV,Aptiv Plc,Aptiv PLC is a technology and mobility architecture company,2011,"Dublin,  Ireland",https://www.aptiv.com/,https://en.wikipedia.org/wiki/aptiv_plc,https://x.com/aptiv,3714,Motor Vehicle Parts & Accessories,31-33,Manufacturing,336,Transportation Equipment Manufacturing,3363,Motor Vehicle Parts Manufacturing,33639,Other Motor Vehicle Parts Manufacturing,336390,Other Motor Vehicle Parts Manufacturing
42,US-38,S&P 500,,,Americas,North America,United States,ARE,"Alexandria Real Estate Equities, Inc.","Alexandria Real Estate Equities, Inc",1994,"California,  United States",http://www.are.com/,https://en.wikipedia.org/wiki/alexandria_real_estate_equities,,6798,Real Estate Investment Trusts,52,Finance And Insurance,525,"Funds, Trusts, And Other Financial Vehicles ",5259,Other Investment Pools And Funds,52599,Other Financial Vehicles ,525990,Other Financial Vehicles 
43,UK-21,,,Nasdaq 100,"Europe, The Middle East and Africa",Western Europe,United Kingdom,ARM,Arm Holdings,"Arm Holdings plc develops and licenses CPU, GPU, and system-level IP used by semiconductor companies to power computing across a broad range of devices and applications.",2018,"Cambridgeshire,  United Kingdom","	arm.com",https://en.wikipedia.org/wiki/Arm_Holdings,https://x.com/Arm,3674,Semiconductors & Related Devices,31-33,Manufacturing,334,Computer And Electronic Product Manufacturing,3344,Semiconductor And Other Electronic Component Manufacturing,33441,Semiconductor And Other Electronic Component Manufacturing,334519,Other Measuring And Controlling Device Manufacturing 
44,NL-13,,,Nasdaq 100,"Europe, The Middle East and Africa",Western Europe,Netherlands,ASML,Asml Holding Nv,ASML Holding N is a diversified company across consumer or industrial sectors.,1994,"Veldhoven,  Netherlands",https://www.asml.com,https://en.wikipedia.org/wiki/ASML_Holding,https://x.com/ASMLcompany,3559,"Special Industry Machinery, Nec",31-33,Manufacturing,333,Machinery Manufacturing,3332,Industrial Machinery Manufacturing,33324,Industrial Machinery Manufacturing,333249,Other Industrial Machinery Manufacturing 
45,US-39,S&P 500,,,Americas,North America,United States,ATO,Atmos Energy Corporation,Atmos Energy Corporation is engaged in the regulated natural gas distribution and pipeline and storage businesses,1981,"Texas,  United States",http://www.atmosenergy.com/,https://en.wikipedia.org/wiki/atmos_energy,https://x.com/atmosenergy,4924,Natural Gas Distribution,22,Utilities,221,Utilities,2212,Natural Gas Distribution,22121,Natural Gas Distribution,221210,Natural Gas Distribution 
46,US-40,S&P 500,,,Americas,North America,United States,ATVI,"Activision Blizzard, Inc.","Activision Blizzard, Inc is a diversified company across consumer or industrial sectors.",2000,"California,  United States",https://www.activisionblizzard.com/,https://en.wikipedia.org/wiki/activision_blizzard,https://x.com/atvi_ab,7372,Prepackaged Software,51,Information,511,Publishing Industries (Except Internet),5112,Software Publishers,51121,Software Publishers,511210,Software Publishers
47,US-41,S&P 500,,,Americas,North America,United States,AVB,"Avalonbay Communities, Inc.","AvalonBay Communities, Inc is a diversified company across consumer or industrial sectors.",1995,"Virginia,  United States",http://www.avalonbay.com/,https://en.wikipedia.org/wiki/avalonbay_communities,https://x.com/avalonbay,6798,Real Estate Investment Trusts,52,Finance And Insurance,525,"Funds, Trusts, And Other Financial Vehicles ",5259,Other Investment Pools And Funds,52599,Other Financial Vehicles ,525990,Other Financial Vehicles 
