144,US-135,S&P 500,DJIA,,Americas,North America,United States,DIS,The Walt Disney Company,The Walt Disney Company is a worldwide entertainment company,2018,"California,  United States",https://www.thewaltdisneycompany.com/,https://en.wikipedia.org/wiki/the_walt_disney_company,https://x.com/disney,7990,Miscellaneous Amusement & Recreation,51,Information,512,Motion Picture And Sound Recording Industries,5121,Motion Picture And Video Industries,51211,Motion Picture And Video Production,512110,Motion Picture And Video Production 
145,US-136,S&P 500,,,Americas,North America,United States,DLR,"Digital Realty Trust, Inc.","Digital Realty Trust, Inc is a diversified company across consumer or industrial sectors.",2004,"Texas,  United States",http://www.digitalrealty.com/,https://en.wikipedia.org/wiki/digital_realty_trust,https://x.com/digitalrealty,6798,Real Estate Investment Trusts,52,Finance And Insurance,525,"Funds, Trusts, And Other Financial Vehicles ",5259,Other Investment Pools And Funds,52599,Other Financial Vehicles ,525990,Other Financial Vehicles 
146,US-137,S&P 500,,,Americas,North America,United States,DLTR,"Dollar Tree, Inc.","Dollar Tree, Inc is a diversified company across consumer or industrial sectors.",2008,"Virginia,  United States",https://www.dollartree.com/,https://en.wikipedia.org/wiki/dollar_tree,https://x.com/dollartree,5331,Variety Stores,44-45,Retail Trade,452,General Merchandise Stores ,4523,"General Merchandise Stores, Including Warehouse Clubs And Supercenters ",45231,"General Merchandise Stores, Including Warehouse Clubs And Supercenters ",452319,All Other General Merchandise Stores 
147,US-138,S&P 500,,,Americas,North America,United States,DOC,Healthpeak Properties,"Healthpeak Properties, Inc. is a healthcare-focused REIT that owns and manages lab facilities, outpatient medical buildings, and retirement communities across the United States.",2022,"Colorado,  United States","	www.healthpeak.com",https://en.wikipedia.org/wiki/Healthpeak_Properties,,6798,Real Estate Investment Trusts,52,Finance And Insurance,525,"Funds, Trusts, And Other Financial Vehicles ",5259,Other Investment Pools And Funds,52599,Other Financial Vehicles ,525990,Other Financial Vehicles 
148,US-139,S&P 500,,,Americas,North America,United States,DOV,Dover Corporation,"Dover Corporation is a manufacturer and solutions provider delivering equipment and components, consumable supplies, aftermarket parts, software and digital solutions, and support services",1947,"Illinois,  United States",http://www.dovercorporation.com/,https://en.wikipedia.org/wiki/dover_corporation,https://x.com/dovercorp,3530,"Construction, Mining & Materials Handling Machinery & Equip",31-33,Manufacturing,333,Machinery Manufacturing,3339,Other General Purpose Machinery Manufacturing,33399,All Other General Purpose Machinery Manufacturing,333999,All Other Miscellaneous General Purpose Machinery Manufacturing 
149,US-140,S&P 500,,,Americas,North America,United States,DOW,Dow Inc.,Dow Inc is a diversified company across consumer or industrial sectors.,2018,"Michigan,  United States",https://www.dow.com/,https://en.wikipedia.org/wiki/dow_inc.,https://x.com/DowNewsroom,2821,"Plastic Materials, Synth Resins & Nonvulcan Elastomers",31-33,Manufacturing,325,Chemical Manufacturing,3252,"Resin, Synthetic Rubber, And Artificial And Synthetic Fibers And Filaments Manufacturing",32521,Resin And Synthetic Rubber Manufacturing,325211,Plastics Material And Resin Manufacturing 
150,US-141,S&P 500,,,Americas,North America,United States,DPZ,"Domino'S Pizza, Inc.","Domino'S Pizza, Inc. is a diversified company across consumer or industrial sectors.",2002,"Michigan,  United States",http://www.dominos.com/,https://en.wikipedia.org/wiki/domino%27s_pizza,https://x.com/dominos,5140,Wholesale-Groceries & Related Products,72,Accommodation And Food Services,722,Food Services And Drinking Places,7225,Restaurants And Other Eating Places,72251,Restaurants And Other Eating Places,722513,Limited-Service Restaurants 
151,US-142,S&P 500,,,Americas,North America,United States,DRI,"Darden Restaurants, Inc.","Darden Restaurants, Inc is a diversified company across consumer or industrial sectors.",1995,"Florida,  United States",https://www.darden.com/,https://en.wikipedia.org/wiki/darden_restaurants,https://x.com/darden,5812,Eating Places,72,Accommodation And Food Services,722,Food Services And Drinking Places,7225,Restaurants And Other Eating Places,72251,Restaurants And Other Eating Places,722511,Full-Service Restaurants 
152,US-143,S&P 500,,,Americas,North America,United States,DTE,Dte Energy Company,"DTE Energy Company is a diversified energy company, which is involved in the development and management of energy-related businesses and services nationwide",1995,"Michigan,  United States",http://newlook.dteenergy.com/,https://en.wikipedia.org/wiki/dte_energy_co.,https://x.com/dte_energy,4911,Electric Services,22,Utilities,221,Utilities,2211,"Electric Power Generation, Transmission And Distribution",22111,Electric Power Generation,221111,Hydroelectric Power Generation 
153,US-144,S&P 500,,,Americas,North America,United States,DUK,Duke Energy Corporation,Duke Energy Corporation is an energy company,2005,"North Carolina,  United States",http://www.duke-energy.com/,https://en.wikipedia.org/wiki/duke_energy,https://x.com/dukeenergy,4931,Electric & Other Services Combined,22,Utilities,221,Utilities,2211,"Electric Power Generation, Transmission And Distribution",22112,"Electric Power Transmission, Control, And Distribution",221122,Electric Power Distribution 
154,US-145,S&P 500,,,Americas,North America,United States,DVA,Davita Inc.,DaVita Inc is a diversified company across consumer or industrial sectors.,1994,"Colorado,  United States",http://www.davita.com/,https://en.wikipedia.org/wiki/davita_inc.,https://x.com/davita,8090,"Misc Health & Allied Services, Nec",62,Health Care And Social Assistance,621,Ambulatory Health Care Services,6214,Outpatient Care Centers,62149,Other Outpatient Care Centers,621492,Kidney Dialysis Centers 
155,US-146,S&P 500,,,Americas,North America,United States,DVN,Devon Energy Corporation,Devon Energy Corporation is an independent energy company,1999,"Oklahoma,  United States",https://www.devonenergy.com/,https://en.wikipedia.org/wiki/devon_energy,https://x.com/devonenergy,1311,Crude Petroleum & Natural Gas,21,"Mining, Quarrying, And Oil And Gas Extraction",211,Oil And Gas Extraction,2111,Oil And Gas Extraction,21112,Crude Petroleum Extraction ,211120,Crude Petroleum Extraction 
156,US-147,S&P 500,,Nasdaq 100,Americas,North America,United States,DXCM,"Dexcom, Inc.","DexCom, Inc is a diversified company across consumer or industrial sectors.",1999,"California,  United States",http://www.dexcom.com/,https://en.wikipedia.org/wiki/dexcom,https://x.com/dexcom,3841,Surgical & Medical Instruments & Apparatus,31-33,Manufacturing,339,Miscellaneous Manufacturing,3391,Medical Equipment And Supplies Manufacturing,33911,Medical Equipment And Supplies Manufacturing,339112,Surgical And Medical Instrument Manufacturing 
157,US-148,S&P 500,,Nasdaq 100,Americas,North America,United States,EA,Electronic Arts Inc.,Electronic Arts Inc is a diversified company across consumer or industrial sectors.,1991,"California,  United States",https://www.ea.com/,https://en.wikipedia.org/wiki/electronic_arts,https://x.com/ea,7372,Prepackaged Software,51,Information,511,Publishing Industries (Except Internet),5112,Software Publishers,51121,Software Publishers,511210,Software Publishers
158,US-149,S&P 500,,,Americas,North America,United States,EBAY,Ebay Inc.,eBay Inc is a diversified company across consumer or industrial sectors.,1998,"California,  United States",https://www.ebayinc.com/,https://en.wikipedia.org/wiki/ebay_inc.,https://x.com/ebay,7389,"Business Services, Nec",44-45,Retail Trade,454,Nonstore Retailers ,4541,Electronic Shopping And Mail-Order Houses ,45411,Electronic Shopping And Mail-Order Houses ,454110,Electronic Shopping And Mail-Order Houses 
159,US-150,S&P 500,,,Americas,North America,United States,ECL,Ecolab Inc.,Ecolab Inc is a diversified company across consumer or industrial sectors.,1924,"Minnesota,  United States",http://www.ecolab.com,https://en.wikipedia.org/wiki/ecolab_inc.,https://x.com/ecolab,2840,"Soap, Detergents, Cleang Preparations, Perfumes, Cosmetics",31-33,Manufacturing,325,Chemical Manufacturing,3256,"Soap, Cleaning Compound, And Toilet Preparation Manufacturing",32561,Soap And Cleaning Compound Manufacturing,325611,Soap And Other Detergent Manufacturing 
160,US-151,S&P 500,,,Americas,North America,United States,ED,"Consolidated Edison, Inc.","Consolidated Edison, Inc is a diversified company across consumer or industrial sectors.",1997,"New York,  United States",http://www.conedison.com/,https://en.wikipedia.org/wiki/consolidated_edison,https://x.com/conedison,4931,Electric & Other Services Combined,22,Utilities,221,Utilities,2211,"Electric Power Generation, Transmission And Distribution",22111,Electric Power Generation,221118,Other Electric Power Generation 
161,US-152,S&P 500,,,Americas,North America,United States,EFX,Equifax Inc.,Equifax Inc is a diversified company across consumer or industrial sectors.,1913,"Georgia,  United States",http://www.equifax.com/,https://en.wikipedia.org/wiki/equifax_inc.,https://x.com/equifax,7320,"Consumer Credit Reporting, Collection Agencies",56,"Administrative Support, Waste Management & Remediation Services",561,Administrative And Support Services,5614,Business Support Services,56145,Credit Bureaus,561450,Credit Bureaus
162,US-153,S&P 500,,,Americas,North America,United States,EG,"Everest Group, Ltd.","Everest Group, Ltd is a diversified company across consumer or industrial sectors.",1999,"Hamilton,  Bermuda",https://www.everestglobal.com/,https://en.wikipedia.org/wiki/Everest_Group,https://x.com/EverestGroup,6331,"Fire, Marine & Casualty Insurance",52,Finance And Insurance,524,Insurance Carriers And Related Activities,5241,Insurance Carriers,52412,"Direct Insurance (Except Life, Health, And Medical) Carriers ",524126,Direct Property And Casualty Insurance Carriers 
163,US-154,S&P 500,,,Americas,North America,United States,EIX,Edison International,"Edison International is the holding company of Southern California Edison Company (SCE) and Edison Energy Group, Inc (Edison Energy Group)",1987,"California,  United States",http://www.edison.com/,https://en.wikipedia.org/wiki/edison_int%27l,https://x.com/edisonintl,4911,Electric Services,22,Utilities,221,Utilities,2211,"Electric Power Generation, Transmission And Distribution",22111,Electric Power Generation,221111,Hydroelectric Power Generation 
164,US-155,S&P 500,,,Americas,North America,United States,EL,The Estee Lauder Companies Inc.,The Estee Lauder Companies Inc is a diversified company across consumer or industrial sectors.,1976,"New York,  United States",https://www.elcompanies.co.uk/,https://en.wikipedia.org/wiki/est%c3%a9e_lauder_companies,https://x.com/esteelauder,2844,"Perfumes, Cosmetics & Other Toilet Preparations",31-33,Manufacturing,325,Chemical Manufacturing,3256,"Soap, Cleaning Compound, And Toilet Preparation Manufacturing",32562,Toilet Preparation Manufacturing,325620,Toilet Preparation Manufacturing
165,US-156,S&P 500,,,Americas,North America,United States,ELV,"Elevance Health, Inc.","Elevance Health, Inc operates in healthcare or pharmaceuticals.",2001,"Indiana,  United States",https://www.elevancehealth.com,https://en.wikipedia.org/wiki/elevance_health,https://x.com/elevancehealth,6324,Hospital & Medical Service Plans,52,Finance And Insurance,524,Insurance Carriers And Related Activities,5241,Insurance Carriers,52411,"Direct Life, Health, And Medical Insurance Carriers ",524114,Direct Health And Medical Insurance Carriers 
167,US-158,S&P 500,,,Americas,North America,United States,EMR,Emerson Electric Co.,Emerson Electric Co is a diversified company across consumer or industrial sectors.,1890,"Missouri,  United States",http://www.emerson.com/,https://en.wikipedia.org/wiki/emerson_electric_company,https://x.com/emerson_news,3600,Electronic & Other Electrical Equipment (No Computer Equip),31-33,Manufacturing,335,"Electrical Equipment, Appliance, And Component Manufacturing",3359,Other Electrical Equipment And Component Manufacturing,33599,All Other Electrical Equipment And Component Manufacturing,335999,All Other Miscellaneous Electrical Equipment And Component Manufacturing 
169,US-160,S&P 500,,,Americas,North America,United States,EOG,"Eog Resources, Inc.","EOG Resources, Inc is a diversified company across consumer or industrial sectors.",1985,"Texas,  United States",https://www.eogresources.com/,https://en.wikipedia.org/wiki/eog_resources,,1311,Crude Petroleum & Natural Gas,21,"Mining, Quarrying, And Oil And Gas Extraction",211,Oil And Gas Extraction,2111,Oil And Gas Extraction,21112,Crude Petroleum Extraction ,211120,Crude Petroleum Extraction 
170,US-161,S&P 500,,,Americas,North America,United States,EPAM,"Epam Systems, Inc.","EPAM Systems, Inc provides technology or software solutions.",2002,"Pennsylvania,  United States",https://www.epam.com,https://en.wikipedia.org/wiki/epam_systems,https://x.com/epamsystems,7371,Computer Programming Services,54,"Professional, Scientific, And Technical Services",541,"Professional, Scientific, And Technical Services",5415,Computer Systems Design And Related Services,54151,Computer Systems Design And Related Services,541511,Custom Computer Programming Services 
171,US-162,S&P 500,,,Americas,North America,United States,EQIX,"Equinix, Inc.","Equinix, Inc is a diversified company across consumer or industrial sectors.",1998,"California,  United States",http://www.equinix.com/,https://en.wikipedia.org/wiki/equinix,https://x.com/equinix,6798,Real Estate Investment Trusts,52,Finance And Insurance,525,"Funds, Trusts, And Other Financial Vehicles ",5259,Other Investment Pools And Funds,52599,Other Financial Vehicles ,525990,Other Financial Vehicles 
172,US-163,S&P 500,,,Americas,North America,United States,EQR,Equity Residential,Equity Residential is a real estate investment trust,1992,"Illinois,  United States",http://www.equityapartments.com/,https://en.wikipedia.org/wiki/equity_residential,https://x.com/equityres,6798,Real Estate Investment Trusts,52,Finance And Insurance,525,"Funds, Trusts, And Other Financial Vehicles ",5259,Other Investment Pools And Funds,52599,Other Financial Vehicles ,525990,Other Financial Vehicles 
173,US-164,S&P 500,,,Americas,North America,United States,EQT,Eqt Corporation,EQT Corporation is a natural gas producer with operations focused on the Marcellus and Utica Shales of the Appalachian Basin,2008,"Pennsylvania,  United States",https://www.eqt.com,https://en.wikipedia.org/wiki/eqt,https://x.com/eqtcorp,1311,Crude Petroleum & Natural Gas,21,"Mining, Quarrying, And Oil And Gas Extraction",211,Oil And Gas Extraction,2111,Oil And Gas Extraction,21112,Crude Petroleum Extraction ,211120,Crude Petroleum Extraction 
174,US-165,S&P 500,,,Americas,North America,United States,ERIE,Erie Indemnity,"Erie Indemnity Company serves as attorney-in-fact for the Erie Insurance Exchange, administering policy, claims, and investment operations for a portfolio of property, casualty, and life insurance subsidiaries.",1925,"Pennsylvania,  United States","	erieinsurance.com",https://en.wikipedia.org/wiki/Erie_Insurance_Group,https://x.com/erie_insurance,6411,Insurance Agents Brokers & Services,52,Finance And Insurance,524,Insurance Carriers And Related Activities,5242,"Agencies, Brokerages, And Other Insurance Related Activities",52421,Insurance Agencies And Brokerages ,524210,Insurance Agencies And Brokerages 
175,US-166,S&P 500,,,Americas,North America,United States,ES,Eversource Energy,Eversource Energy is a utility holding company that is engaged in the energy delivery business through its subsidiaries,1927,"Massachusetts,  United States",http://www.eversource.com/,https://en.wikipedia.org/wiki/eversource_energy,https://x.com/eversourcecorp,4911,Electric Services,22,Utilities,221,Utilities,2211,"Electric Power Generation, Transmission And Distribution",22112,"Electric Power Transmission, Control, And Distribution",221122,Electric Power Distribution 
176,US-167,S&P 500,,,Americas,North America,United States,ESS,"Essex Property Trust, Inc.","Essex Property Trust, Inc is a diversified company across consumer or industrial sectors.",1994,"California,  United States",http://www.essexapartmenthomes.com/,"https://en.wikipedia.org/wiki/essex_property_trust,_inc.",,6798,Real Estate Investment Trusts,52,Finance And Insurance,525,"Funds, Trusts, And Other Financial Vehicles ",5259,Other Investment Pools And Funds,52599,Other Financial Vehicles ,525990,Other Financial Vehicles 
177,IE-23,S&P 500,,,"Europe, The Middle East and Africa",Western Europe,Ireland,ETN,Eaton Corporation Public Limited Company,Eaton Corporation plc is a power management company,2012,"Dublin,  Ireland",http://www.eaton.com/,https://en.wikipedia.org/wiki/eaton_corporation,https://x.com/eatoncorp,3590,Misc Industrial & Commercial Machinery & Equipment,31-33,Manufacturing,333,Machinery Manufacturing,3339,Other General Purpose Machinery Manufacturing,33399,All Other General Purpose Machinery Manufacturing,333999,All Other Miscellaneous General Purpose Machinery Manufacturing 
178,US-168,S&P 500,,,Americas,North America,United States,ETR,Entergy Corporation,Entergy Corporation is an integrated energy company engaged in electric power production and retail distribution operations,1992,"Louisiana,  United States",http://www.entergy.com/,https://en.wikipedia.org/wiki/entergy_corp.,https://x.com/entergy,4911,Electric Services,22,Utilities,221,Utilities,2211,"Electric Power Generation, Transmission And Distribution",22111,Electric Power Generation,221113,Nuclear Electric Power Generation 
179,US-169,S&P 500,,,Americas,North America,United States,EVRG,"Evergy, Inc.","Evergy, Inc is a diversified company across consumer or industrial sectors.",2017,"Missouri,  United States",http://www.evergyinc.com/,https://en.wikipedia.org/wiki/evergy,https://x.com/evergypower,4931,Electric & Other Services Combined,22,Utilities,221,Utilities,2211,"Electric Power Generation, Transmission And Distribution",22111,Electric Power Generation,221111,Hydroelectric Power Generation 
180,US-170,S&P 500,,,Americas,North America,United States,EW,Edwards Lifesciences Corporation,Edwards Lifesciences Corporation is a manufacturer of heart valve systems and repair products used to replace or repair a patient's diseased or defective heart valve,1999,"California,  United States",http://www.edwards.com/,https://en.wikipedia.org/wiki/edwards_lifesciences,https://x.com/edwardslifesci,3842,"Orthopedic, Prosthetic & Surgical Appliances & Supplies",31-33,Manufacturing,339,Miscellaneous Manufacturing,3391,Medical Equipment And Supplies Manufacturing,33911,Medical Equipment And Supplies Manufacturing,339113,Surgical Appliance And Supplies Manufacturing 
181,US-171,S&P 500,,Nasdaq 100,Americas,North America,United States,EXC,Exelon Corporation,Exelon Corporation is an energy delivery company,1999,"Illinois,  United States",http://www.exeloncorp.com/,https://en.wikipedia.org/wiki/exelon_corp.,https://x.com/exelon,4931,Electric & Other Services Combined,22,Utilities,221,Utilities,2211,"Electric Power Generation, Transmission And Distribution",22111,Electric Power Generation,221111,Hydroelectric Power Generation 
182,US-172,S&P 500,,,Americas,North America,United States,EXE,Expand Energy,"Expand Energy Corporation is a U.S. natural gas producer focused on shale development in Appalachia and Louisiana, supplying LNG, oil, and gas through vertically integrated operations.",1996,"Oklahoma,  United States","	expandenergy.com",https://en.wikipedia.org/wiki/Expand_Energy,,1311,Crude Petroleum & Natural Gas,21,"Mining, Quarrying, And Oil And Gas Extraction",211,Oil And Gas Extraction,2111,Oil And Gas Extraction,21112,Crude Petroleum Extraction ,211120,Crude Petroleum Extraction 
183,US-173,S&P 500,,,Americas,North America,United States,EXPD,"Expeditors International Of Washington, Inc","Expeditors International of Washington, Inc is a diversified company across consumer or industrial sectors.",1979,"Washington,  United States",http://www.expeditors.com/,https://en.wikipedia.org/wiki/expeditors_international,,4731,Arrangement Of Transportation Of Freight & Cargo,48-49,Transportation And Warehousing,488,Support Activities For Transportation,4885,Freight Transportation Arrangement,48851,Freight Transportation Arrangement,488510,Freight Transportation Arrangement
184,US-174,S&P 500,,,Americas,North America,United States,EXPE,"Expedia Group, Inc.","Expedia Group, Inc is a diversified company across consumer or industrial sectors.",2005,"Washington,  United States",https://www.expediagroup.com/,https://en.wikipedia.org/wiki/expedia_group,https://x.com/expedia,4700,Transportation Services,56,"Administrative Support, Waste Management & Remediation Services",561,Administrative And Support Services,5615,Travel Arrangement And Reservation Services,56151,Travel Agencies,561510,Travel Agencies
185,US-175,S&P 500,,,Americas,North America,United States,EXR,Extra Space Storage Inc.,Extra Space Storage Inc is a diversified company across consumer or industrial sectors.,2004,"Utah,  United States",http://www.extraspace.com/,https://en.wikipedia.org/wiki/extra_space_storage,https://x.com/extraspace,6798,Real Estate Investment Trusts,52,Finance And Insurance,525,"Funds, Trusts, And Other Financial Vehicles ",5259,Other Investment Pools And Funds,52599,Other Financial Vehicles ,525990,Other Financial Vehicles 
186,US-176,S&P 500,,,Americas,North America,United States,F,Ford Motor Company,Ford Motor Company is an automobile company,1919,"Michigan,  United States",https://www.ford.co.uk/,https://en.wikipedia.org/wiki/ford_motor_company,https://x.com/ford,3711,Motor Vehicles & Passenger Car Bodies,31-33,Manufacturing,336,Transportation Equipment Manufacturing,3361,Motor Vehicle Manufacturing,33611,Automobile And Light Duty Motor Vehicle Manufacturing,336111,Automobile Manufacturing 
187,US-177,S&P 500,,Nasdaq 100,Americas,North America,United States,FANG,"Diamondback Energy, Inc.","Diamondback Energy, Inc is active in the energy sector.",2011,"Texas,  United States",https://ir.diamondbackenergy.com/,https://en.wikipedia.org/wiki/diamondback_energy,https://x.com/Diamondback_EP,1311,Crude Petroleum & Natural Gas,21,"Mining, Quarrying, And Oil And Gas Extraction",211,Oil And Gas Extraction,2111,Oil And Gas Extraction,21112,Crude Petroleum Extraction ,211120,Crude Petroleum Extraction 
188,US-178,S&P 500,,Nasdaq 100,Americas,North America,United States,FAST,Fastenal Company,Fastenal Company is engaged in the wholesale distribution of industrial and construction supplies,1968,"Minnesota,  United States",https://www.fastenal.com/,https://en.wikipedia.org/wiki/fastenal_co,https://x.com/fastenalcompany,5200,"Building Materials, Hardware, Garden Supply",23,Construction,238,Specialty Trade Contractors,2382,Building Equipment Contractors,23829,Other Building Equipment Contractors,238290,Other Building Equipment Contractors 
189,US-179,S&P 500,,,Americas,North America,United States,FCX,Freeport-Mcmoran Inc.,Freeport-McMoRan Inc is a diversified company across consumer or industrial sectors.,1987,"Arizona,  United States",http://fcx.com/,https://en.wikipedia.org/wiki/freeport-mcmoran_inc.,https://x.com/fm_fcx,1000,Metal Mining,21,"Mining, Quarrying, And Oil And Gas Extraction",212,Mining (Except Oil And Gas),2122,Metal Ore Mining,21223,"Copper, Nickel, Lead, And Zinc Mining",212230,"Copper, Nickel, Lead, And Zinc Mining "
190,US-180,S&P 500,,,Americas,North America,United States,FDS,Factset Research Systems Inc.,FactSet Research Systems Inc provides technology or software solutions.,1984,"Connecticut,  United States",https://www.factset.com,https://en.wikipedia.org/wiki/factset,https://x.com/factset,7370,"Computer Programming, Data Processing, Etc.",52,Finance And Insurance,523,"Securities, Commodity Contracts, And Other Financial Investments And Related Activities",5239,Other Financial Investment Activities,52399,All Other Financial Investment Activities ,523999,Miscellaneous Financial Investment Activities 
191,US-181,S&P 500,,,Americas,North America,United States,FDX,Fedex Corporation,"FedEx Corporation (FedEx) provides a portfolio of transportation, e-commerce and business services through companies competing collectively and operating independently, under the FedEx brand",1997,"Tennessee,  United States",http://www.fedex.com/,https://en.wikipedia.org/wiki/fedex_corporation,https://x.com/fedex,4513,Air Courier Services,48-49,Transportation And Warehousing,492,Couriers And Messengers,4921,Couriers And Express Delivery Services,49211,Couriers And Express Delivery Services,492110,Couriers And Express Delivery Services
192,US-182,S&P 500,,,Americas,North America,United States,FE,Firstenergy Corp.,"FirstEnergy Corp (FirstEnergy) and its subsidiaries are principally involved in the transmission, distribution, and generation of electricity",1996,"Ohio,  United States",http://www.firstenergycorp.com/,https://en.wikipedia.org/wiki/firstenergy_corp,https://x.com/firstenergycorp,4911,Electric Services,22,Utilities,221,Utilities,2211,"Electric Power Generation, Transmission And Distribution",22111,Electric Power Generation,221111,Hydroelectric Power Generation 
